{"schema_version": "proteus.player_manifest.v0", "n_regs": 10, "tape_words": 128, "genome": [2119564291, 2238299959, 2790170860, 2529132362, 3117250021, 719917526, 4267436290, 2793883888, 103836881, 342248709, 649856793, 4231690684, 2307626598, 2820635676, 3550874035, 559368867, 743317150, 3894749915, 4220924875, 111123109, 256287523, 304888601, 1571769763, 424452747, 3507516195, 726104004, 1462467504, 4148720113, 2197553837, 1755539422, 3625988052, 2662733100, 3801620231, 3740458269, 2353750707, 2652355727, 2119564291, 2238299959, 2790170860, 2529132362, 2307626598, 2820635676, 3550874035, 559368867, 728041919, 3427715686, 2902461813, 593104060], "code_writable": true, "persist": "all", "tick_budget": 512, "out_cap": 1}